{
  "schemaVersion": 1,
  "revision": 1,
  "updatedAt": "2026-10-27T09:00:00+09:00",
  "messages": [
    {
      "id": "msg-0001",
      "number": 1,
      "keyword": "到着",
      "aliases": ["とうちゃく", "着きました", "到着しました"],
      "text": "お待たせいたしました。ただいまお届け先に到着しました。",
      "category": "到着連絡",
      "createdAt": "2026-10-27T09:00:00+09:00",
      "updatedAt": "2026-10-27T09:00:00+09:00",
      "deletedAt": null
    },
    {
      "id": "msg-0002",
      "number": 2,
      "keyword": "置き配",
      "aliases": ["おきはい", "置き配完了", "玄関前"],
      "text": "ご指定の場所（玄関前）に商品をお届けしました。\n写真をアプリに添付しておりますので、ご確認ください。\nご利用ありがとうございました！",
      "category": "完了連絡",
      "createdAt": "2026-10-27T09:00:00+09:00",
      "updatedAt": "2026-10-27T09:00:00+09:00",
      "deletedAt": null
    },
    {
      "id": "msg-0003",
      "number": 3,
      "keyword": "遅延",
      "aliases": ["ちえん", "遅れます", "遅れ"],
      "text": "申し訳ございません。道路が混雑しており、到着が5〜10分ほど遅れる見込みです。安全運転でお届けいたしますので、今しばらくお待ちください。",
      "category": "遅延連絡",
      "createdAt": "2026-10-27T09:00:00+09:00",
      "updatedAt": "2026-10-27T09:00:00+09:00",
      "deletedAt": null
    },
    {
      "id": "msg-0004",
      "number": 4,
      "keyword": "部屋番号",
      "aliases": ["へやばんごう", "部屋番号確認", "号室"],
      "text": "配達員です。お届け先のお部屋番号（号室）が確認できませんでした。\nお手数ですが、お部屋番号を教えていただけますでしょうか。",
      "category": "確認",
      "createdAt": "2026-10-27T09:00:00+09:00",
      "updatedAt": "2026-10-27T09:00:00+09:00",
      "deletedAt": null
    },
    {
      "id": "msg-0005",
      "number": 5,
      "keyword": "オートロック",
      "aliases": ["おーとろっく", "エントランス", "解錠"],
      "text": "エントランスに到着しました。\nオートロックの解錠をお願いいたします🙇",
      "category": "到着連絡",
      "createdAt": "2026-10-27T09:00:00+09:00",
      "updatedAt": "2026-10-27T09:00:00+09:00",
      "deletedAt": null
    },
    {
      "id": "msg-0006",
      "number": 6,
      "keyword": "電話",
      "aliases": ["でんわ", "電話に出られない", "不在"],
      "text": "お電話いたしましたが、つながりませんでした📞\nお手すきの際に、このメッセージへご返信いただけますと幸いです。",
      "category": "確認",
      "createdAt": "2026-10-27T09:00:00+09:00",
      "updatedAt": "2026-10-27T09:00:00+09:00",
      "deletedAt": null
    },
    {
      "id": "msg-0007",
      "number": 7,
      "keyword": "お礼",
      "aliases": ["おれい", "ありがとう", "感謝"],
      "text": "このたびはご注文いただき、誠にありがとうございました😊\n\nまたのご利用を心よりお待ちしております。\n――――――――\n※本メッセージへのご返信は不要です。\n※お気づきの点がございましたら、アプリのサポートよりご連絡ください。\n\n良い一日をお過ごしください🍀✨",
      "category": "完了連絡",
      "createdAt": "2026-10-27T09:00:00+09:00",
      "updatedAt": "2026-10-27T09:00:00+09:00",
      "deletedAt": null
    },
    {
      "id": "msg-0008",
      "number": 8,
      "keyword": "駐車",
      "aliases": ["ちゅうしゃ", "駐車場"],
      "text": "近くに駐車できる場所がないため、少し離れた場所に停めて徒歩で向かいます。到着まで2〜3分お待ちください。",
      "category": "遅延連絡",
      "createdAt": "2026-10-27T09:00:00+09:00",
      "updatedAt": "2026-10-27T09:00:00+09:00",
      "deletedAt": null
    },
    {
      "id": "msg-0009",
      "number": 9,
      "keyword": "旧到着",
      "aliases": ["古い到着"],
      "text": "（削除済みサンプル）到着しました。",
      "category": "到着連絡",
      "createdAt": "2026-10-20T09:00:00+09:00",
      "updatedAt": "2026-10-26T09:00:00+09:00",
      "deletedAt": "2026-10-26T09:00:00+09:00"
    }
  ]
}
